{
  "schemaVersion": "pinn.problemDefinition/1.2",
  "problemId": "pdef-poisson1d-cal-v1",
  "revision": 1,
  "pde": {
    "form": "strong",
    "transient": false,
    "equations": [
      {
        "name": "poisson-1d",
        "expressionRef": {
          "artifactId": "governance/POISSON_1D_V1.0_spec.draft.json",
          "sha256": "53580ebcc99af50bb47ebf1e1d92a0722af757b6497573661e0e717a718ac125"
        },
        "independentVars": [
          "x"
        ],
        "dependentVars": [
          "u"
        ]
      }
    ]
  },
  "boundaryConditions": [
    {
      "name": "left-dirichlet",
      "type": "dirichlet",
      "regionRef": "x0",
      "expressionRef": {
        "artifactId": "governance/POISSON_1D_V1.0_spec.draft.json",
        "sha256": "53580ebcc99af50bb47ebf1e1d92a0722af757b6497573661e0e717a718ac125"
      },
      "enforcement": "soft"
    },
    {
      "name": "right-dirichlet",
      "type": "dirichlet",
      "regionRef": "x1",
      "expressionRef": {
        "artifactId": "governance/POISSON_1D_V1.0_spec.draft.json",
        "sha256": "53580ebcc99af50bb47ebf1e1d92a0722af757b6497573661e0e717a718ac125"
      },
      "enforcement": "soft"
    }
  ],
  "geometry": {
    "domainType": "interval",
    "dimension": 1,
    "regions": [
      {
        "id": "interior",
        "description": "0 < x < 1"
      },
      {
        "id": "x0",
        "description": "x = 0"
      },
      {
        "id": "x1",
        "description": "x = 1"
      }
    ]
  },
  "parameters": [
    {
      "name": "forcing_amplitude_pi_squared",
      "value": 9.869604401089358,
      "unitRef": "1"
    },
    {
      "name": "forcing_wavenumber_k",
      "value": 1.0,
      "unitRef": "1"
    }
  ],
  "units": {
    "system": "nondimensional",
    "entries": [
      {
        "quantity": "length",
        "unit": "1",
        "symbolRef": "x"
      },
      {
        "quantity": "field",
        "unit": "1",
        "symbolRef": "u"
      }
    ]
  },
  "nondimensionalization": {
    "applied": false,
    "scales": [],
    "notes": "posed dimensionless by construction (spec draft v1.0)"
  },
  "variables": [
    {
      "name": "x",
      "role": "independent",
      "domainRange": [
        0.0,
        1.0
      ],
      "unitRef": "1"
    },
    {
      "name": "u",
      "role": "dependent",
      "domainRange": [
        -1.5,
        1.5
      ],
      "unitRef": "1"
    }
  ],
  "referenceSolution": {
    "sources": [
      {
        "sourceId": "src-analytic",
        "method": "analytical",
        "evidenceLevel": "A",
        "independenceDeclaration": true,
        "provenance": {
          "artifactId": "pinn/reference/analytic_poisson.py",
          "sha256": "d792fd0ec91827bb6fcf38039893839024517c603bb4e5efcd0f7fe54b30a06d"
        }
      },
      {
        "sourceId": "src-fdm",
        "method": "numerical",
        "evidenceLevel": "B",
        "independenceDeclaration": true,
        "provenance": {
          "artifactId": "scientific_reference/poisson_fdm.py",
          "sha256": "075f856dba84a9a8dc7fc9216f6317b256668d24ece1f0c74fc4772e3257300f"
        }
      }
    ],
    "primarySourceId": "src-analytic"
  },
  "checkApplicability": [
    {
      "checkId": "M1-fieldCountClosure",
      "dimension": "math",
      "applicability": "APPLICABLE"
    },
    {
      "checkId": "M2-boundaryConditionCount",
      "dimension": "math",
      "applicability": "APPLICABLE"
    },
    {
      "checkId": "M3-dimensionalHomogeneity",
      "dimension": "math",
      "applicability": "APPLICABLE"
    },
    {
      "checkId": "M5-geometryBinding",
      "dimension": "math",
      "applicability": "APPLICABLE"
    },
    {
      "checkId": "M6-referenceEquationBinding",
      "dimension": "math",
      "applicability": "APPLICABLE"
    },
    {
      "checkId": "T1-autogradVsFiniteDifference",
      "dimension": "impl",
      "applicability": "APPLICABLE"
    },
    {
      "checkId": "T3-residualOperatorOnReference",
      "dimension": "impl",
      "applicability": "APPLICABLE"
    },
    {
      "checkId": "T4-boundaryOperatorOnReference",
      "dimension": "impl",
      "applicability": "APPLICABLE"
    },
    {
      "checkId": "T8-lossTermSeparation",
      "dimension": "impl",
      "applicability": "APPLICABLE"
    },
    {
      "checkId": "T9-collocationDisjointness",
      "dimension": "impl",
      "applicability": "APPLICABLE"
    },
    {
      "checkId": "T10-validatorControlFixtures",
      "dimension": "impl",
      "applicability": "APPLICABLE"
    },
    {
      "checkId": "G4-trainingIntegrity",
      "dimension": "train",
      "applicability": "APPLICABLE"
    },
    {
      "checkId": "G4-seedProtocol",
      "dimension": "train",
      "applicability": "APPLICABLE"
    },
    {
      "checkId": "G4-lossErrorDecoupling",
      "dimension": "train",
      "applicability": "APPLICABLE"
    },
    {
      "checkId": "PH1-fluxBalance",
      "dimension": "physics",
      "applicability": "APPLICABLE"
    },
    {
      "checkId": "PH2-energyBalance",
      "dimension": "physics",
      "applicability": "APPLICABLE"
    },
    {
      "checkId": "PH3-positivity",
      "dimension": "physics",
      "applicability": "APPLICABLE"
    },
    {
      "checkId": "PH4-symmetry",
      "dimension": "physics",
      "applicability": "APPLICABLE"
    },
    {
      "checkId": "PH5-monotonicity",
      "dimension": "physics",
      "applicability": "APPLICABLE"
    },
    {
      "checkId": "PH6-maximumPrinciple",
      "dimension": "physics",
      "applicability": "APPLICABLE"
    },
    {
      "checkId": "PH7-spd",
      "dimension": "physics",
      "applicability": "APPLICABLE"
    },
    {
      "checkId": "PH10-momentumBudget",
      "dimension": "physics",
      "applicability": "NOT_APPLICABLE",
      "reason": "scalar Poisson equation has no momentum variable (protocol section 3 applicability table)"
    },
    {
      "checkId": "PH11-freeEnergy",
      "dimension": "physics",
      "applicability": "NOT_APPLICABLE",
      "reason": "steady elliptic equation has no dissipative free-energy structure; the energy identity PH2 covers it"
    },
    {
      "checkId": "G5b-acceptanceCriteriaMust",
      "dimension": "external",
      "applicability": "APPLICABLE"
    },
    {
      "checkId": "G5b-acceptanceCriteriaShould",
      "dimension": "external",
      "applicability": "APPLICABLE"
    },
    {
      "checkId": "G6-independentReproduction",
      "dimension": "repro",
      "applicability": "APPLICABLE"
    }
  ],
  "preregistration": {
    "errorNorm": "relativeL2",
    "epsilonSpec": 0.001,
    "seedRuns": 10,
    "seedFactors": [
      "init",
      "sample",
      "batch"
    ],
    "worstSeedFactor": 3.0,
    "dispersionLimit": 1.0
  },
  "evaluationSets": {
    "train": {
      "artifactId": "set-train-pdef-poisson1d-cal-v1-r1",
      "sha256": "9acd944dd99b3caf9cdd61ff64ce5769dfc47efed0d76a0bfcf7638d87ce913f"
    },
    "dev": {
      "artifactId": "set-dev-pdef-poisson1d-cal-v1-r1",
      "sha256": "8b28ab8545ae8774e73df26dd050261cea18f496054380e4c9691a8505f3b73c"
    },
    "claim": {
      "artifactId": "set-claim-pdef-poisson1d-cal-v1-r1",
      "sha256": "02ee4e7533ea0eb0ff16828bb6f447e0c63f217b2e911ea1eabd6862659eb08e"
    },
    "phys": {
      "artifactId": "set-phys-pdef-poisson1d-cal-v1-r1",
      "sha256": "d63b11bd2f811f4ac62536ca3d744fef0552860ebb9adfffbf95edd9382dd933"
    },
    "minSeparation": 1e-09,
    "claimSetStatus": "SEALED",
    "claimSetHistory": []
  },
  "status": "FROZEN",
  "frozenAt": "2026-09-16T06:55:10Z",
  "frozenBy": "pinn.experiments.runner (Claude, captain)",
  "specHash": "3dc9cd62e242e1bc447269f1e9f7c70c3044797eaa620c7b938b54910367b854"
}
