{
  "schemaVersion": "pinn.problemDefinition/1.2",
  "problemId": "pdef-poisson2d-cal-v1",
  "revision": 1,
  "pde": {
    "form": "strong",
    "transient": false,
    "equations": [
      {
        "name": "poisson-2d",
        "expressionRef": {
          "artifactId": "specs/poisson-2d/v1.0/POISSON_2D_V1.0_spec.json",
          "sha256": "46e98c699e00ca108d39f11bd38b37933bea8323b2f24d2af48fc8f7dcdb5269"
        },
        "independentVars": [
          "x",
          "y"
        ],
        "dependentVars": [
          "u"
        ]
      }
    ]
  },
  "boundaryConditions": [
    {
      "name": "left-dirichlet",
      "type": "dirichlet",
      "regionRef": "x0",
      "expressionRef": {
        "artifactId": "specs/poisson-2d/v1.0/POISSON_2D_V1.0_spec.json",
        "sha256": "46e98c699e00ca108d39f11bd38b37933bea8323b2f24d2af48fc8f7dcdb5269"
      },
      "enforcement": "hard"
    },
    {
      "name": "right-dirichlet",
      "type": "dirichlet",
      "regionRef": "x1",
      "expressionRef": {
        "artifactId": "specs/poisson-2d/v1.0/POISSON_2D_V1.0_spec.json",
        "sha256": "46e98c699e00ca108d39f11bd38b37933bea8323b2f24d2af48fc8f7dcdb5269"
      },
      "enforcement": "hard"
    },
    {
      "name": "bottom-dirichlet",
      "type": "dirichlet",
      "regionRef": "y0",
      "expressionRef": {
        "artifactId": "specs/poisson-2d/v1.0/POISSON_2D_V1.0_spec.json",
        "sha256": "46e98c699e00ca108d39f11bd38b37933bea8323b2f24d2af48fc8f7dcdb5269"
      },
      "enforcement": "hard"
    },
    {
      "name": "top-dirichlet",
      "type": "dirichlet",
      "regionRef": "y1",
      "expressionRef": {
        "artifactId": "specs/poisson-2d/v1.0/POISSON_2D_V1.0_spec.json",
        "sha256": "46e98c699e00ca108d39f11bd38b37933bea8323b2f24d2af48fc8f7dcdb5269"
      },
      "enforcement": "hard"
    }
  ],
  "geometry": {
    "domainType": "rectangle",
    "dimension": 2,
    "regions": [
      {
        "id": "interior",
        "description": "0 < x < 1 and 0 < y < 1"
      },
      {
        "id": "x0",
        "description": "x = 0, 0 <= y <= 1"
      },
      {
        "id": "x1",
        "description": "x = 1, 0 <= y <= 1"
      },
      {
        "id": "y0",
        "description": "y = 0, 0 <= x <= 1"
      },
      {
        "id": "y1",
        "description": "y = 1, 0 <= x <= 1"
      }
    ]
  },
  "parameters": [
    {
      "name": "forcing_amplitude_two_pi_squared",
      "value": 19.739208802178716,
      "unitRef": "1"
    },
    {
      "name": "forcing_wavenumber_kx",
      "value": 1.0,
      "unitRef": "1"
    },
    {
      "name": "forcing_wavenumber_ky",
      "value": 1.0,
      "unitRef": "1"
    }
  ],
  "units": {
    "system": "nondimensional",
    "entries": [
      {
        "quantity": "length",
        "unit": "1",
        "symbolRef": "x"
      },
      {
        "quantity": "field",
        "unit": "1",
        "symbolRef": "u"
      }
    ]
  },
  "nondimensionalization": {
    "applied": false,
    "scales": [],
    "notes": "posed dimensionless by construction (2D spec v1.0)"
  },
  "variables": [
    {
      "name": "x",
      "role": "independent",
      "domainRange": [
        0.0,
        1.0
      ],
      "unitRef": "1"
    },
    {
      "name": "y",
      "role": "independent",
      "domainRange": [
        0.0,
        1.0
      ],
      "unitRef": "1"
    },
    {
      "name": "u",
      "role": "dependent",
      "domainRange": [
        -1.5,
        1.5
      ],
      "unitRef": "1"
    }
  ],
  "referenceSolution": {
    "sources": [
      {
        "sourceId": "src-analytic",
        "method": "analytical",
        "evidenceLevel": "A",
        "independenceDeclaration": true,
        "provenance": {
          "artifactId": "pinn/reference/analytic_poisson2d.py",
          "sha256": "a387d8cfc79db224c41fd68d8771fed76a7b3f32c76a893c3ce016b169ecbbca"
        }
      },
      {
        "sourceId": "src-fdm2d",
        "method": "numerical",
        "evidenceLevel": "B",
        "independenceDeclaration": true,
        "provenance": {
          "artifactId": "scientific_reference/poisson2d_fdm.py",
          "sha256": "874f20b598346d9e44c19026faf97e8279a63f9b5fc358851e24c03dac9a5b77"
        }
      }
    ],
    "primarySourceId": "src-analytic"
  },
  "checkApplicability": [
    {
      "checkId": "M1-fieldCountClosure",
      "dimension": "math",
      "applicability": "APPLICABLE"
    },
    {
      "checkId": "M2-boundaryConditionCount",
      "dimension": "math",
      "applicability": "APPLICABLE"
    },
    {
      "checkId": "M3-dimensionalHomogeneity",
      "dimension": "math",
      "applicability": "APPLICABLE"
    },
    {
      "checkId": "M5-geometryBinding",
      "dimension": "math",
      "applicability": "APPLICABLE"
    },
    {
      "checkId": "M6-referenceEquationBinding",
      "dimension": "math",
      "applicability": "APPLICABLE"
    },
    {
      "checkId": "T1-autogradVsFiniteDifference",
      "dimension": "impl",
      "applicability": "APPLICABLE"
    },
    {
      "checkId": "T2-secondDerivativeComponentSeparation",
      "dimension": "impl",
      "applicability": "APPLICABLE"
    },
    {
      "checkId": "T3-residualOperatorOnReference",
      "dimension": "impl",
      "applicability": "APPLICABLE"
    },
    {
      "checkId": "T4-boundaryOperatorFourEdges",
      "dimension": "impl",
      "applicability": "APPLICABLE"
    },
    {
      "checkId": "T8-lossTermSeparation",
      "dimension": "impl",
      "applicability": "APPLICABLE"
    },
    {
      "checkId": "T9-collocationDisjointness",
      "dimension": "impl",
      "applicability": "APPLICABLE"
    },
    {
      "checkId": "T10-validatorControlFixtures",
      "dimension": "impl",
      "applicability": "APPLICABLE"
    },
    {
      "checkId": "G4-trainingIntegrity",
      "dimension": "train",
      "applicability": "APPLICABLE"
    },
    {
      "checkId": "G4-seedProtocol",
      "dimension": "train",
      "applicability": "APPLICABLE"
    },
    {
      "checkId": "G4-lossErrorDecoupling",
      "dimension": "train",
      "applicability": "APPLICABLE"
    },
    {
      "checkId": "PH1-fluxBalance",
      "dimension": "physics",
      "applicability": "APPLICABLE"
    },
    {
      "checkId": "PH2-energyBalance",
      "dimension": "physics",
      "applicability": "APPLICABLE"
    },
    {
      "checkId": "PH3-positivity",
      "dimension": "physics",
      "applicability": "APPLICABLE"
    },
    {
      "checkId": "PH4-symmetry",
      "dimension": "physics",
      "applicability": "APPLICABLE"
    },
    {
      "checkId": "PH5-monotonicity",
      "dimension": "physics",
      "applicability": "APPLICABLE"
    },
    {
      "checkId": "PH6-maximumPrinciple",
      "dimension": "physics",
      "applicability": "APPLICABLE"
    },
    {
      "checkId": "PH7-spd",
      "dimension": "physics",
      "applicability": "APPLICABLE"
    },
    {
      "checkId": "PH10-momentumBudget",
      "dimension": "physics",
      "applicability": "NOT_APPLICABLE",
      "reason": "scalar Poisson equation has no momentum variable; adding a dimension does not create one"
    },
    {
      "checkId": "PH11-freeEnergy",
      "dimension": "physics",
      "applicability": "NOT_APPLICABLE",
      "reason": "steady elliptic equation has no dissipative free-energy structure; the energy identity PH2 covers it"
    },
    {
      "checkId": "G5b-acceptanceCriteriaMust",
      "dimension": "external",
      "applicability": "APPLICABLE"
    },
    {
      "checkId": "G5b-acceptanceCriteriaShould",
      "dimension": "external",
      "applicability": "APPLICABLE"
    },
    {
      "checkId": "G6-independentReproduction",
      "dimension": "repro",
      "applicability": "APPLICABLE"
    }
  ],
  "preregistration": {
    "errorNorm": "relativeL2",
    "epsilonSpec": 0.001,
    "seedRuns": 10,
    "seedFactors": [
      "init",
      "sample",
      "batch"
    ],
    "worstSeedFactor": 3.0,
    "dispersionLimit": 1.0
  },
  "evaluationSets": {
    "train": {
      "artifactId": "set-train-pdef-poisson2d-cal-v1-r1",
      "sha256": "ddbac79c99d071900943ae89af8bb43c1bdc655b2091e01a9d6859455a97a997"
    },
    "dev": {
      "artifactId": "set-dev-pdef-poisson2d-cal-v1-r1",
      "sha256": "625b76935b6a0334925a0898d12852aa327ab0c46276d1861b341f94931ee417"
    },
    "claim": {
      "artifactId": "set-claim-pdef-poisson2d-cal-v1-D2C-GL32-CGL50",
      "sha256": "d4d2dd4a4d1c05b6ca31d67d5ee23c04c09481347f6acf51d0b0577ed37ff4e6"
    },
    "phys": {
      "artifactId": "set-phys-pdef-poisson2d-cal-v1-r1",
      "sha256": "8d8a61b67c23409bd0e83cf27d1ad7cbac06be254928ee904381f1de67129ad6"
    },
    "minSeparation": 1e-09,
    "claimSetStatus": "SEALED",
    "claimSetHistory": []
  },
  "status": "FROZEN",
  "frozenAt": "2026-09-16T12:29:08Z",
  "frozenBy": "pinn.experiments2d.runner2d (Claude, captain)",
  "specHash": "05328d507582e20e57d00a339f6cddb783b40be4c138acdd85a31a5540552c6d"
}
